Channel,Titles
Talk de Autoconhecimento,Happy | Documentário para assistir no Netflix
Talk de Autoconhecimento,Resumo do livro: O Poder da Autorresponsabilidade | Paulo Vieira
Talk de Autoconhecimento,Resumo do livro - O Jeito Harvard de ser Feliz | Shawn Achor
Talk de Autoconhecimento,Os benefícios de colorir - PARA ADULTOS
Talk de Autoconhecimento,Heal -  O Poder da Mente | Documentário para assistir no Netflix
Talk de Autoconhecimento,Resumo do livro: O Milagre da Manhã | Hal Elrod
Talk de Autoconhecimento,Resumo do livro: Aprendizados | Gisele Bündchen
Talk de Autoconhecimento,Resumo do livro: As coisas que você só vê quando desacelera | Haemin Sunim
Talk de Autoconhecimento,O menino que descobriu o vento | FILME para assistir no NETFLIX
Talk de Autoconhecimento,Aprendizados inspirados no livro: O Milagre da Manhã - Hal Elrod
Talk de Autoconhecimento,Projetos Paralelos - Como criar e tirar a ideia do papel
Talk de Autoconhecimento,5 DICAS para ter Relações Saudáveis
Talk de Autoconhecimento,Gratidão para uma vida com mais significado
Talk de Autoconhecimento,Aprendizados inspirados no livro: O Poder da Autorresponsabilidade | Paulo Vieira
Talk de Autoconhecimento,Resiliência: O que é? Como ser?
Talk de Autoconhecimento,Meditação: Como iniciar e benefícios
Talk de Autoconhecimento,Erros de gravação
Talk de Autoconhecimento,Empatia - A solução para a humanidade?
Talk de Autoconhecimento,Não tenha medo de fracassar
Talk de Autoconhecimento,Como relaxar em menos de dois minutos?
