Channel,Titles
Pedro Schetine,Como fazer hambúrguer artesanal (caseiro) / MUITO FÁCIL DE FAZER! Hambúrguer de costela e bacon!
Pedro Schetine,Como fica o aluguel com o coronavírus?
Pedro Schetine,Aumento de preços sem justo motivo CDC
Pedro Schetine,Como improvisar na guitarra?
Pedro Schetine,Como fazer milk shake de ovomaltine? MUITO FÁCIL DE FAZER!
Pedro Schetine,Como ficam as mensalidades de escolas e faculdades com o coronavírus?
Pedro Schetine,Igual ao Teu / Samuel e Sabrina Brum / Cover - Pedro Schetine
Pedro Schetine,PRORROGAÇÃO DO AUXÍLIO EMERGENCIAL (4ª e 5ª PARCELAS) - O QUE MUDOU? O AUXÍLIO FOI SUSPENSO?
Pedro Schetine,Honra e Glória  - Viva Adoração // Cover - Pedro Schetine
Pedro Schetine,Cordeiro e Leão - Central 3 / Cover - Pedro Schetine
