Channel,Titles
Luciana Fiaux - Domine suas Finanças,LIVRE-SE DAS DÍVIDAS EM TEMPO RECORDE!
Luciana Fiaux - Domine suas Finanças,MEUS SEGREDOS PARA O DINHEIRO SOBRAR TODO MÊS!
Luciana Fiaux - Domine suas Finanças,UNICK FOREX É UMA BOA?
Luciana Fiaux - Domine suas Finanças,NUCONTA É MELHOR QUE POUPANÇA?
Luciana Fiaux - Domine suas Finanças,"SE NÃO PAGAR DÍVIDA, O QUE ACONTECE?"
Luciana Fiaux - Domine suas Finanças,8 ITENS QUE NÃO GASTO MAIS DINHEIRO!
Luciana Fiaux - Domine suas Finanças,ESTRATÉGIAS PARA NEGOCIAR DÍVIDA DO CARTÃO
Luciana Fiaux - Domine suas Finanças,COMO PARAR DE USAR CARTÃO DE CRÉDITO
Luciana Fiaux - Domine suas Finanças,CONTAS DIGITAIS: veja a melhor e mais segura!
Luciana Fiaux - Domine suas Finanças,PARE AGORA DE FICAR ANOTANDO GASTOS!
Luciana Fiaux - Domine suas Finanças,TESOURO SELIC: PASSO A PASSO PARA INVESTIR SEM MEDO
Luciana Fiaux - Domine suas Finanças,COMO PEGAR EMPRÉSTIMO MAIS BARATO
Luciana Fiaux - Domine suas Finanças,ENCONTRO 1: Comece o Desafio dos R$100!
Luciana Fiaux - Domine suas Finanças,Investindo sem Medo - Episódio 1: O melhor investimento
Luciana Fiaux - Domine suas Finanças,PASSO A PASSO PARA SAIR DO CHEQUE ESPECIAL
Luciana Fiaux - Domine suas Finanças,COMO ECONOMIZAR COM MERCADO!
Luciana Fiaux - Domine suas Finanças,CONTA DE LUZ: 7 DICAS PARA ECONOMIZAR!!
Luciana Fiaux - Domine suas Finanças,ORGANIZAR AS FINANÇAS NÃO É FÁCIL! MAS É SIMPLES!
Luciana Fiaux - Domine suas Finanças,Como guardar dinheiro mesmo com as finanças desorganizadas
Luciana Fiaux - Domine suas Finanças,POR ONDE COMEÇAR A ORGANIZAÇÃO FINANCEIRA
